{
  "schema_version": "skills-orchestrator.github-app-installation.v1",
  "installation": {
    "id": 123456,
    "account": "example-org"
  },
  "repository": {
    "full_name": "example-org/example-repo",
    "default_branch": "main"
  },
  "permissions": {
    "contents": "read",
    "metadata": "read",
    "pull_requests": "write",
    "checks": "write"
  },
  "events": ["pull_request", "push", "check_suite"]
}
